link;title;year;streamings;synopsis_content;synopsis_lemming;synopsis_stemming;just_watch_rating;rotten_tomatoes_rating;imdb_ratings;genres;movie_duration;age_classification
https://www.justwatch.com/br/filme/weapons-2025;Hora do Desaparecimento(2025);(2025);['Apple TV', 'Apple TV', 'Apple TV', 'Amazon Prime Video', 'Cinesystem Cinemas', 'Claro tv+', 'Amazon Video', 'Amazon Video'];Em uma pequena cidade, um evento inexplicável rasga a normalidade: todas as crianças de uma mesma turma desaparecem na mesma noite, no mesmo instante — exceto uma. Enquanto a comunidade se desespera entre teorias e suspeitas, a garota restante guarda um segredo perturbador. O que aconteceu naquela hora fatídica? E por que ela foi poupada?;['pequena', 'cidade', 'evento', 'inexplicável', 'rasga', 'normalidade', 'toda', 'crianças', 'mesma', 'turma', 'desaparecem', 'mesma', 'noite', 'instante', 'exceto', 'enquanto', 'comunidade', 'desespera', 'teorias', 'suspeitas', 'garota', 'restante', 'guarda', 'segredo', 'perturbador', 'aconteceu', 'naquela', 'hora', 'fatídica', 'poupada'];['pequen', 'cidad', 'event', 'inexplic', 'rasg', 'normal', 'tod', 'crianç', 'mesm', 'turm', 'desaparec', 'mesm', 'noit', 'instant', '—', 'excet', 'enquant', 'comunidad', 'desesp', 'teor', 'suspeit', 'garot', 'rest', 'guard', 'segred', 'perturb', 'acontec', 'naquel', 'hor', 'fatíd', 'poup'];92%(3.4k);93%;7.6  (170k);['Terror', 'Mistério & Thriller', 'Suspense de Terror'];2h 9min;18
https://www.justwatch.com/br/filme/superman-legacy;Superman(2025);(2025);['HBO Max Amazon Channel', 'Claro tv+', 'Amazon Video', 'Amazon Prime Video', 'Amazon Video', 'HBO Max Amazon Channel', 'HBO Max'];Ser um dos maiores símbolos de esperança não é fácil, e Clark Kent precisa reconciliar sua herança como Super-Homem com sua criação humana. Em um mundo que vê bondade como antiquada, Clark vira o herói que engloba verdade e justiça.;['maiores', 'símbolos', 'esperança', 'fácil', 'clark', 'kent', 'precisa', 'reconciliar', 'herança', 'superhomem', 'criação', 'humana', 'mundo', 'bondade', 'antiquada', 'clark', 'vira', 'herói', 'engloba', 'verdade', 'justiça'];['mai', 'símbol', 'esperanç', 'fácil', 'clark', 'kent', 'precis', 'reconcili', 'heranç', 'superhom', 'cri', 'human', 'mund', 'vê', 'bondad', 'antiqu', 'clark', 'vir', 'heró', 'englob', 'verdad', 'justiç'];89%(7.2k);83%;7.2  (316k);['Ação & Aventura', 'Ficção Científica', 'Super-Herói'];2h 9min;14
https://www.justwatch.com/br/filme/f1;F1 - O Filme(2025);(2025);['Apple TV', 'Apple TV', 'Amazon Video', 'Amazon Prime Video'];Focando no ex-piloto de Fórmula 1, Sonny Hayes (Brad Pitt), um piloto rebelde dispostos a arriscar tudo retorna as pistas 30 anos após um terrível acidente. Agora, o veterano das pistas monta uma estratégia para apoiar o novato, Joshua Pearce (Damson Idris), e revitalizar o time.;['focando', 'expiloto', 'fórmula', 'sonny', 'hayes', 'brad', 'pitt', 'piloto', 'rebelde', 'dispostos', 'arriscar', 'tudo', 'retorna', 'pistas', 'ano', 'após', 'terrível', 'acidente', 'agora', 'veterano', 'pistas', 'monta', 'estratégia', 'apoiar', 'novato', 'joshua', 'pearce', 'damson', 'idris', 'revitalizar', 'time'];['foc', 'expilot', 'fórmul', '1', 'sonny', 'hay', 'brad', 'pitt', 'pilot', 'rebeld', 'dispost', 'arrisc', 'tud', 'retorn', 'pist', '30', 'ano', 'após', 'terr', 'acid', 'agor', 'veter', 'pist', 'mont', 'estratég', 'apoi', 'novat', 'joshu', 'pearc', 'damson', 'idril', 'revital', 'tim'];95%(4k);82%;7.7  (220k);['Ação & Aventura', 'Drama', 'Esporte & Fitness', 'Drama Esportivo'];2h 36min;12
https://www.justwatch.com/br/filme/materialists;O Match Perfeito(2025);(2025);['HBO Max Amazon Channel', 'Apple TV', 'Apple TV', 'Claro tv+', 'Amazon Prime Video', 'Amazon Video', 'HBO Max Amazon Channel', 'HBO Max'];Lucy (Dakota Johnson) é uma casamenteira de sucesso que busca encontrar o amor perfeito para todos os seus clientes. Porém, na sua vida pessoal ela fica em meio a um triângulo amoroso após começar um relacionamento com um homem rico (Pedro Pascal) e reencontrar um antigo amor imperfeito (Chris Evans).;['lucy', 'dakota', 'johnson', 'casamenteira', 'sucesso', 'busca', 'encontrar', 'amor', 'perfeito', 'todos', 'clientes', 'porém', 'vida', 'pessoal', 'fica', 'meio', 'triângulo', 'amoroso', 'após', 'começar', 'relacionamento', 'homem', 'rico', 'pedro', 'pascal', 'reencontrar', 'antigo', 'amor', 'imperfeito', 'chris', 'evans'];['lucy', 'dakot', 'johnson', 'casament', 'sucess', 'busc', 'encontr', 'am', 'perfeit', 'tod', 'client', 'porém', 'vid', 'pessoal', 'fic', 'mei', 'triângul', 'amor', 'após', 'começ', 'relacion', 'hom', 'ric', 'pedr', 'pasc', 'reencontr', 'antig', 'am', 'imperfeit', 'chril', 'ev'];77%(1.4k);79%;6.3  (55k);['Romance', 'Drama', 'Comédia', 'Comédia Romântica'];1h 56min;14
https://www.justwatch.com/br/filme/thunderbolts;*Os Novos Vingadores(2025);(2025);['Disney Plus', 'Disney Plus', 'Amazon Prime Video'];O que acontece quando um grupo improvável com heróis e anti-heróis se forma? Bucky, Yelena, Wyatt e o Guardião Vermelho são apenas o começo dos Thunderbolts que lutam juntos para salvar o mundo.;['acontece', 'grupo', 'improvável', 'heróis', 'antiheróis', 'forma', 'bucky', 'yelena', 'wyatt', 'guardião', 'vermelho', 'apenas', 'começo', 'thunderbolt', 'lutam', 'junto', 'salvar', 'mundo'];['acontec', 'grup', 'improv', 'herol', 'antiherol', 'form', 'bucky', 'yelen', 'wyatt', 'guard', 'vermelh', 'apen', 'começ', 'thunderbolt', 'lut', 'junt', 'salv', 'mund'];92%(8.6k);88%;7.1  (224k);['Fantasia', 'Ficção Científica', 'Ação & Aventura', 'Crime', 'Drama', 'Super-Herói'];2h 7min;14
https://www.justwatch.com/br/filme/pecadores;Pecadores(2025);(2025);['HBO Max Amazon Channel', 'Apple TV', 'Apple TV', 'Apple TV', 'Amazon Prime Video', 'Amazon Video', 'Amazon Video', 'HBO Max Amazon Channel', 'HBO Max'];Retornando para sua cidade natal em busca de uma nova vida, os irmãos gêmeos tentam colocar o passado devastador para trás. Porém, eles logo descobrem que forças muito mais sombrias estão os esperando.;['retornando', 'cidade', 'natal', 'busca', 'nova', 'vida', 'irmãos', 'gêmeos', 'tentam', 'colocar', 'passado', 'devastador', 'trás', 'porém', 'logo', 'descobrem', 'forças', 'sombrias', 'esperando'];['retorn', 'cidad', 'natal', 'busc', 'nov', 'vid', 'irm', 'gême', 'tent', 'coloc', 'pass', 'devast', 'trá', 'porém', 'log', 'descobr', 'forç', 'sombr', 'esper'];89%(13k);97%;7.6  (281k);['Mistério & Thriller', 'Ação & Aventura', 'Drama', 'Terror', 'Música & Musical', 'Suspense de Terror'];2h 17min;16
https://www.justwatch.com/br/filme/uma-batalha-apos-a-outra;Batalha Atrás de Batalha(2025);(2025);['UCIcinemas', 'Cinesystem Cinemas', 'Amazon Prime Video', 'Cineflix'];Bob Ferguson (Leonardo DiCaprio), é um ex-revolucionário que passou sua juventude como integrante de um grupo de guerrilha. Dezesseis anos depois, ele precisa retornar a sua vida antiga quando um inimigo do seu passado sequestra sua filha, fazendo de tudo para resgatá-la antes que seja tarde demais.;['bob', 'ferguson', 'leonardo', 'dicaprio', 'exrevolucionário', 'passou', 'juventude', 'integrante', 'grupo', 'guerrilha', 'dezesseis', 'ano', 'precisa', 'retornar', 'vida', 'antiga', 'inimigo', 'passado', 'sequestra', 'filha', 'fazendo', 'tudo', 'resgatála', 'ante', 'tarde', 'demais'];['bob', 'ferguson', 'leonard', 'dicapri', 'exrevolucion', 'pass', 'juventud', 'integr', 'grup', 'guerrilh', 'dezessel', 'ano', 'precis', 'retorn', 'vid', 'antig', 'inimig', 'pass', 'sequestr', 'filh', 'faz', 'tud', 'resgatál', 'ant', 'tard', 'demal'];93%(882);96%;8.4  (60k);['Mistério & Thriller', 'Crime', 'Drama', 'Ação & Aventura'];2h 42min;16
https://www.justwatch.com/br/filme/highest-2-lowest;Céus e Infernos(2025);(2025);['Apple TV+', 'Apple TV+', 'Apple TV Plus Amazon Channel', 'Apple TV+'];Neste filme da A24, o magnata da música, David King (Denzel Washington), é conhecido como um dos melhores do ramo. Mas quando tentam raptar o seu filho, ele fica preso em um dilema moral complexo em meio ao resgate.;['neste', 'filme', 'magnata', 'música', 'david', 'king', 'denzel', 'washington', 'conhecido', 'melhores', 'ramo', 'tentam', 'raptar', 'filho', 'fica', 'preso', 'dilema', 'moral', 'complexo', 'meio', 'resgate'];['nest', 'film', 'a24', 'magnat', 'músic', 'david', 'king', 'denzel', 'washington', 'conhec', 'melhor', 'ram', 'tent', 'rapt', 'filh', 'fic', 'pres', 'dilem', 'moral', 'complex', 'mei', 'resgat'];57%(903);84%;5.6  (19k);['Mistério & Thriller', 'Drama', 'Crime'];2h 13min;16
https://www.justwatch.com/br/filme/the-thursday-murder-club;O Clube do Crime das Quintas-Feiras(2025);(2025);['Netflix', 'Netflix Standard with Ads', 'Amazon Prime Video'];Por diversão, um grupo de aposentados se encontra toda quinta-feira para investigar casos antigos arquivados pela polícia. Porém, eles acabam envolvidos na investigação que toma um rumo bem perigoso quando se deparam com um assassinato misterioso.;['diversão', 'grupo', 'aposentados', 'encontra', 'toda', 'quintafeira', 'investigar', 'casos', 'antigos', 'arquivados', 'polícia', 'porém', 'acabam', 'envolvidos', 'investigação', 'toma', 'rumo', 'bem', 'perigoso', 'deparam', 'assassinato', 'misterioso'];['divers', 'grup', 'aposent', 'encontr', 'tod', 'quintaf', 'investig', 'cas', 'antig', 'arquiv', 'políci', 'porém', 'acab', 'envolv', 'investig', 'tom', 'rum', 'bem', 'perig', 'dep', 'assassinat', 'misteri'];88%(3.7k);77%;6.5  (57k);['Comédia', 'Mistério & Thriller', 'Crime', 'Thriller de Mistério'];1h 58min;12
https://www.justwatch.com/br/filme/missao-impossivel-ajuste-de-contas-parte-dois;Missão: Impossível - O Acerto Final(2025);(2025);['Apple TV', 'Apple TV', 'Apple TV', 'Amazon Prime Video', 'Claro tv+', 'Amazon Video', 'Amazon Video'];Ethan Hunt e sua equipe de espiões continuam em busca da Entidade após o fim de Missão Impossível: Acerto de Contas. Como a segunda parte do filme, Ethan faz de tudo para derrotar Gabriel e destruir a Entidade, antes que a Inteligência Artificial seja usada para dominar o mundo.;['ethan', 'hunt', 'equipe', 'espiões', 'continuam', 'busca', 'entidade', 'após', 'fim', 'missão', 'impossível', 'acerto', 'contas', 'segunda', 'parte', 'filme', 'ethan', 'faz', 'tudo', 'derrotar', 'gabriel', 'destruir', 'entidade', 'ante', 'inteligência', 'artificial', 'usada', 'dominar', 'mundo'];['ethan', 'hunt', 'equip', 'espiã', 'continu', 'busc', 'entidad', 'após', 'fim', 'miss', 'imposs', 'acert', 'cont', 'segund', 'part', 'film', 'ethan', 'faz', 'tud', 'derrot', 'gabriel', 'destru', 'entidad', 'ant', 'intelig', 'artific', 'us', 'domin', 'mund'];90%(3.3k);80%;7.2  (167k);['Ação & Aventura', 'Mistério & Thriller', 'Espionagem', 'Thriller de Ação'];2h 50min;14
https://www.justwatch.com/br/filme/28-years-later;Extermínio: A Evolução(2025);(2025);['HBO Max Amazon Channel', 'Apple TV', 'Apple TV', 'Apple TV', 'Amazon Prime Video', 'Claro tv+', 'Amazon Video', 'Amazon Video', 'Claro video', 'HBO Max Amazon Channel', 'HBO Max'];28 anos após a praga de infectados violentos atingir a Grã-Bretanha, um grupo isolado em uma ilha, vive aparado por um muro. Quando um jovem sai da ilha em uma missão importante, ele descobre novos horrores e mutações que impactaram os infectados e os sobreviventes.;['ano', 'após', 'praga', 'infectados', 'violentos', 'atingir', 'grãbretanha', 'grupo', 'isolado', 'ilha', 'vive', 'aparado', 'muro', 'jovem', 'sai', 'ilha', 'missão', 'importante', 'descobre', 'novos', 'horrores', 'mutações', 'impactaram', 'infectados', 'sobreviventes'];['28', 'ano', 'após', 'prag', 'infect', 'violent', 'ating', 'grãbretanh', 'grup', 'isol', 'ilh', 'viv', 'apar', 'mur', 'jov', 'sai', 'ilh', 'miss', 'import', 'descobr', 'nov', 'horr', 'mut', 'impact', 'infect', 'sobreviv'];81%(3.7k);88%;6.6  (140k);['Ficção Científica', 'Mistério & Thriller', 'Terror', 'Suspense de Terror'];1h 55min;18
https://www.justwatch.com/br/filme/lilo-and-stitch-2024;Lilo e Stitch(2025);(2025);['Disney Plus', 'Disney Plus', 'Amazon Prime Video'];Após perder os pais, Lilo mora com sua irmã, Nani, levando uma vida solitária, quando conhece Stitch. Pensando que o pequeno alienígena é um cachorro, Lilo tenta treinar essa máquina de caos, mas ele traz mais confusões para a vida das irmãs. Apesar disso, eles formam uma conexão improvável, que demonstra o verdadeiro significado de família.;['após', 'perder', 'pais', 'lilo', 'mora', 'irmã', 'nani', 'levando', 'vida', 'solitária', 'conhece', 'stitch', 'pensando', 'pequeno', 'alienígena', 'cachorro', 'lilo', 'tenta', 'treinar', 'máquina', 'caos', 'traz', 'confusões', 'vida', 'irmãs', 'apesar', 'disso', 'formam', 'conexão', 'improvável', 'demonstra', 'verdadeiro', 'significado', 'família'];['após', 'perd', 'pal', 'lil', 'mor', 'irmã', 'nan', 'lev', 'vid', 'solitár', 'conhec', 'stitch', 'pens', 'pequen', 'alienígen', 'cachorr', 'lil', 'tent', 'trein', 'máquin', 'cao', 'traz', 'confus', 'vid', 'irmã', 'apes', 'diss', 'form', 'conex', 'improv', 'demonstr', 'verd', 'signific', 'famíl'];88%(3.2k);72%;6.7  (78k);['Família', 'Fantasia', 'Ficção Científica', 'Ação & Aventura', 'Comédia', 'Drama', 'Live-Action'];1h 48min;10
https://www.justwatch.com/br/filme/exterminio;Extermínio(2002);(2002);['HBO Max Amazon Channel', 'Apple TV', 'Apple TV', 'Apple TV', 'Amazon Prime Video', 'Claro tv+', 'Amazon Video', 'Amazon Video', 'Claro video', 'HBO Max Amazon Channel', 'HBO Max'];Quando um vírus sem cura espalha pelo Reino Unido em 28 dias, os infectados se tornam assassinos mortos-vivos. Enquanto isso, os pouco sobreviventes tentam achar um santuário antes que seja tarde de mais.;['vírus', 'cura', 'espalha', 'reino', 'unido', 'dia', 'infectados', 'tornam', 'assassinos', 'mortosvivos', 'enquanto', 'pouco', 'sobreviventes', 'tentam', 'achar', 'santuário', 'ante', 'tarde'];['víru', 'cur', 'espalh', 'rein', 'unid', '28', 'dia', 'infect', 'torn', 'assassin', 'mortosv', 'enquant', 'pouc', 'sobreviv', 'tent', 'ach', 'santu', 'ant', 'tard'];94%(21k);87%;7.5  (520k);['Ficção Científica', 'Mistério & Thriller', 'Drama', 'Terror', 'Ficção Científica de Zumbi'];1h 53min;16
https://www.justwatch.com/br/filme/bring-her-back;Volta Para Mim(2025);(2025);['Amazon Video', 'Amazon Prime Video'];Em um terror da A24 dirigido por Danny e Michael Philippou, dois irmãos descobrem segredos malignos na casa de sua mãe adotiva. Nesta casa no meio do nada, eles descobrem sobre um ritual aterrorizante capaz de destruir a relação dos dois.;['terror', 'dirigido', 'danny', 'michael', 'philippou', 'doi', 'irmãos', 'descobrem', 'segredos', 'malignos', 'casa', 'mãe', 'adotiva', 'nesta', 'casa', 'meio', 'nada', 'descobrem', 'sobre', 'ritual', 'aterrorizante', 'capaz', 'destruir', 'relação', 'doi'];['terr', 'a24', 'dirig', 'danny', 'michael', 'philipp', 'doi', 'irm', 'descobr', 'segred', 'malign', 'cas', 'mãe', 'adot', 'nest', 'cas', 'mei', 'nad', 'descobr', 'sobr', 'rit', 'aterroriz', 'capaz', 'destru', 'relaç', 'doi'];90%(1.9k);89%;7.2  (75k);['Terror', 'Suspense de Terror'];1h 44min;18
https://www.justwatch.com/br/filme/black-bag;Código Preto(2025);(2025);['Amazon Prime Video', 'Apple TV', 'Amazon Prime Video', 'Apple TV', 'Amazon Prime Video', 'Apple TV', 'Amazon Video', 'Amazon Video', 'Claro video', 'Amazon Prime Video with Ads'];A agente Kathryn é a suspeita número um de roubar e trair sua nação, colocando o seu marido George como o agente em sua investigação. Os dois precisam decidir suas lealdades, para o seu país ou casamento.;['agente', 'kathryn', 'suspeita', 'número', 'roubar', 'trair', 'nação', 'colocando', 'marido', 'george', 'agente', 'investigação', 'doi', 'precisam', 'decidir', 'lealdades', 'país', 'casamento'];['agent', 'kathryn', 'suspeit', 'númer', 'roub', 'tra', 'naçã', 'coloc', 'marid', 'georg', 'agent', 'investig', 'doi', 'precis', 'decid', 'lealdad', 'país', 'cas'];84%(3k);96%;6.7  (69k);['Drama', 'Mistério & Thriller', 'Romance'];1h 34min;14
https://www.justwatch.com/br/filme/demon-slayer-kimetsu-no-yaiba-infinity-castle;Demon Slayer: Kimetsu no Yaiba Castelo Infinito(2025);(2025);['UCIcinemas', 'Cinesystem Cinemas', 'Amazon Prime Video', 'Cineflix'];Como o primeiro filme da trilogia final de Demon Slayer, o filme é o começo do fim do anime, adaptando o arco do Castelo Infinito. A jornada de Tanjiro se aproxima de seu fim quando a Demon Slayer Corps vai para o Castelo Infinito derrotar Muzan.;['primeiro', 'filme', 'trilogia', 'final', 'demon', 'slayer', 'filme', 'começo', 'fim', 'anime', 'adaptando', 'arco', 'castelo', 'infinito', 'jornada', 'tanjiro', 'aproxima', 'fim', 'demon', 'slayer', 'corp', 'vai', 'castelo', 'infinito', 'derrotar', 'muzan'];['prim', 'film', 'trilog', 'final', 'demon', 'slay', 'film', 'começ', 'fim', 'anim', 'adapt', 'arc', 'castel', 'infinit', 'jorn', 'tanjir', 'aprox', 'fim', 'demon', 'slay', 'corp', 'vai', 'castel', 'infinit', 'derrot', 'muzan'];92%(539);98%;8.6  (36k);['Ação & Aventura', 'Fantasia', 'Mistério & Thriller', 'Animação', 'Anime Japonês Clássico'];2h 36min;18
https://www.justwatch.com/br/filme/falling-down;Um Dia de Raiva(1993);(1993);['HBO Max Amazon Channel', 'Apple TV', 'Apple TV', 'Apple TV', 'Amazon Prime Video', 'Amazon Video', 'Amazon Video', 'HBO Max Amazon Channel', 'HBO Max'];Prendergast (Robert Duvall), um policial em seu último dia de trabalho pois vai se aposentar, arrisca sua vida para tentar deter William Foster (Michael Douglas), um homem emocionalmente perturbado que perdeu seu emprego e vai ao encontro de Beth (Barbara Hershey), sua ex-mulher, e da filha, sem requer reconhecer que o seu casamento já acabou há muito tempo. Em seu caminho, William vai eliminando quem cruza seu destino.;['prendergast', 'robert', 'duvall', 'policial', 'último', 'dia', 'trabalho', 'poi', 'vai', 'aposentar', 'arrisca', 'vida', 'tentar', 'deter', 'william', 'foster', 'michael', 'douglas', 'homem', 'emocionalmente', 'perturbado', 'perdeu', 'emprego', 'vai', 'encontro', 'beth', 'barbara', 'hershey', 'exmulher', 'filha', 'requer', 'reconhecer', 'casamento', 'acabou', 'tempo', 'caminho', 'william', 'vai', 'eliminando', 'cruza', 'destino'];['prendergast', 'robert', 'duvall', 'polic', 'últ', 'dia', 'trabalh', 'poi', 'vai', 'aposent', 'arrisc', 'vid', 'tent', 'det', 'will', 'fost', 'michael', 'dougl', 'hom', 'emoc', 'perturb', 'perd', 'empreg', 'vai', 'encontr', 'beth', 'barb', 'hershey', 'exmulh', 'filh', 'requ', 'reconhec', 'cas', 'acab', 'temp', 'caminh', 'will', 'vai', 'elimin', 'cruz', 'destin'];94%(7.1k);75%;7.6  (220k);['Crime', 'Drama', 'Mistério & Thriller', 'Europeu', 'Thriller de Ação'];1h 53min;16
https://www.justwatch.com/br/filme/manas;Manas(2025);(2025);['Apple TV', 'Apple TV', 'Apple TV', 'Amazon Prime Video', 'Claro tv+', 'Telecine Amazon Channel'];Vivendo na Ilha de Marajó, no Pará, Marcielle vive com sua família em um local repleto de violências. Agora mais velha, ela começa a perceber como todos estão presos em um lugar marcado por dor e sofrimento, enfrentando toda a violência para liberar sua família.;['vivendo', 'ilha', 'marajó', 'pará', 'marcielle', 'vive', 'família', 'local', 'repleto', 'violências', 'agora', 'velha', 'começa', 'perceber', 'todos', 'presos', 'lugar', 'marcado', 'dor', 'sofrimento', 'enfrentando', 'toda', 'violência', 'liberar', 'família'];['viv', 'ilh', 'marajó', 'par', 'marciell', 'viv', 'famíl', 'local', 'replet', 'viol', 'agor', 'velh', 'começ', 'perceb', 'tod', 'pres', 'lug', 'marc', 'dor', 'sofr', 'enfrent', 'tod', 'viol', 'liber', 'famíl'];NAOAVALIADO;NAOAVALIADO;7.8;['Drama', 'Drama Emocionante'];1h 41min;16
https://www.justwatch.com/br/filme/the-naked-gun-2025;The Naked Gun: Aonde É Que Para a Polícia?!(2025);(2025);['Apple TV', 'Apple TV', 'Apple TV', 'Amazon Prime Video', 'Claro tv+', 'Amazon Video', 'Amazon Video'];Liam Neeson é o protagonista Frank Drebin Jr. nessa nova adaptação deCorra que a Polícia Vem Aí.Comandando o esquadrão da polícia, ele tenta seguir os passos de seu pai e salvar o mundo em uma aventura hilária.;['liam', 'neeson', 'protagonista', 'frank', 'drebin', 'nessa', 'nova', 'adaptação', 'decorra', 'polícia', 'vem', 'aícomandando', 'esquadrão', 'polícia', 'tenta', 'seguir', 'passos', 'pai', 'salvar', 'mundo', 'aventura', 'hilária'];['li', 'neeson', 'protagon', 'frank', 'drebin', 'jr', 'ness', 'nov', 'adapt', 'decorr', 'políci', 'vem', 'aícomand', 'esquadr', 'políci', 'tent', 'segu', 'pass', 'pai', 'salv', 'mund', 'avent', 'hilár'];84%(1.3k);88%;6.5  (70k);['Ação & Aventura', 'Comédia', 'Crime', 'Ação e Comédia'];1h 25min;14
https://www.justwatch.com/br/filme/unknown-number-the-high-school-catfish;Número Desconhecido: Catfish no Liceu(2025);(2025);['Netflix', 'Netflix Standard with Ads', 'Amazon Prime Video'];Mensagens sórdidas e ofensivas inundam os telemóveis de um jovem casal de namorados. Quem as envia e porquê? Este documentário surpreendente revela a verdade chocante.;['mensagens', 'sórdidas', 'ofensivas', 'inundam', 'telemóveis', 'jovem', 'casal', 'namorados', 'envia', 'porquê', 'documentário', 'surpreendente', 'revela', 'verdade', 'chocante'];['mens', 'sórd', 'ofens', 'inund', 'telemó', 'jov', 'casal', 'namor', 'env', 'porqu', 'document', 'surpreend', 'revel', 'verdad', 'choc'];86%(1.1k);85%;6.7  (16k);['Documentário', 'Crime'];1h 34min;16
https://www.justwatch.com/br/filme/a-vida-de-chuck;A Vida de Chuck(2025);(2025);['Cinesystem Cinemas', 'Amazon Prime Video'];Contando a história de Charles Krantz (Tom Hiddleston), essa adaptação foca nos eventos que moldaram sua vida. Começando com sua morte aos 39 anos, a vida de Charles foi marcada por mistérios e transformações que permearam sua existência.;['contando', 'história', 'charles', 'krantz', 'tom', 'hiddleston', 'adaptação', 'foca', 'eventos', 'moldaram', 'vida', 'começando', 'morte', 'ano', 'vida', 'charles', 'marcada', 'mistérios', 'transformações', 'permearam', 'existência'];['cont', 'histór', 'charl', 'krantz', 'tom', 'hiddleston', 'adapt', 'foc', 'event', 'mold', 'vid', 'começ', 'mort', '39', 'ano', 'vid', 'charl', 'marc', 'mistéri', 'transform', 'perme', 'exist'];85%(667);80%;7.3  (35k);['Fantasia', 'Drama', 'Ficção Científica', 'Drama de Ficção Científica'];1h 51min;12
https://www.justwatch.com/br/filme/a-longa-marcha-caminhe-ou-morra;A Longa Marcha: Caminhe ou Morra(2025);(2025);['UCIcinemas', 'Cinesystem Cinemas', 'Amazon Prime Video', 'Kinoplex', 'Cineflix'];Nos Estados Unidos em um futuro distópico, um regime autoritário comanda uma competição em que 50 jovens andam até apenas um permanecer de pé. Enfrentando exaustão e lutando pela sobrevivência em uma competição que tropeçar pode ser o fim, os jovens fazem de tudo para serem o vencedor e ter o seu desejo realizado como prêmio.;['estados', 'unidos', 'futuro', 'distópico', 'regime', 'autoritário', 'comanda', 'competição', 'jovens', 'andam', 'apenas', 'permanecer', 'enfrentando', 'exaustão', 'lutando', 'sobrevivência', 'competição', 'tropeçar', 'pode', 'fim', 'jovens', 'fazem', 'tudo', 'serem', 'vencedor', 'ter', 'desejo', 'realizado', 'prêmio'];['est', 'unid', 'futur', 'distóp', 'regim', 'autorit', 'comand', 'compet', '50', 'jov', 'and', 'apen', 'permanec', 'pé', 'enfrent', 'exaust', 'lut', 'sobreviv', 'compet', 'tropeç', 'pod', 'fim', 'jov', 'faz', 'tud', 'ser', 'venc', 'ter', 'desej', 'realiz', 'prêmi'];85%(366);88%;7.3  (26k);['Terror', 'Mistério & Thriller'];1h 49min;18
https://www.justwatch.com/br/filme/the-conjuring-4-extrema-uncao;The Conjuring 4: Extrema-Unção(2025);(2025);['UCIcinemas', 'Cinesystem Cinemas', 'Amazon Prime Video', 'Kinoplex', 'Cineflix'];Ed e Lorraine retornam em sua última investigação no caso aterrorizante com entidades misteriosas. O casal paranormal precisa encarar seus maiores medos, arriscando suas vidas mais uma vez na luta contra forças malignas que desafiam a compreensão.;['lorraine', 'retornam', 'última', 'investigação', 'caso', 'aterrorizante', 'entidades', 'misteriosas', 'casal', 'paranormal', 'precisa', 'encarar', 'maiores', 'medos', 'arriscando', 'vidas', 'vez', 'luta', 'contra', 'forças', 'malignas', 'desafiam', 'compreensão'];['ed', 'lorrain', 'retorn', 'últ', 'investig', 'cas', 'aterroriz', 'entidad', 'misteri', 'casal', 'paranorm', 'precis', 'encar', 'mai', 'med', 'arrisc', 'vid', 'vez', 'lut', 'contr', 'forç', 'malign', 'desaf', 'compreens'];84%(690);59%;6.4  (40k);['Terror', 'Mistério & Thriller', 'Suspense de Terror'];2h 15min;16
https://www.justwatch.com/br/filme/the-fantastic-four;O Quarteto Fantástico: Primeiros Passos(2025);(2025);['UCIcinemas', 'Kinoplex', 'Amazon Prime Video'];Sr. Fantástico, Mulher Invisível, Tocha Humana e a Coisa, enfrentam o poderoso Galactus em uma Nova York retrofuturista. Nos anos 60 em uma linha do tempo alternativa, o quarteto fantástico entra para o Universo Cinematográfico da Marvel.;['fantástico', 'mulher', 'invisível', 'tocha', 'humana', 'coisa', 'enfrentam', 'poderoso', 'galactus', 'nova', 'york', 'retrofuturista', 'ano', 'linha', 'tempo', 'alternativa', 'quarteto', 'fantástico', 'entra', 'universo', 'cinematográfico', 'marvel'];['sr', 'fant', 'mulh', 'invis', 'toch', 'human', 'cois', 'enfrent', 'poder', 'galactu', 'nov', 'york', 'retrofutur', 'ano', '60', 'linh', 'temp', 'altern', 'quartet', 'fant', 'entr', 'univers', 'cinematográf', 'marvel'];92%(2.9k);86%;7.1  (159k);['Ficção Científica', 'Ação & Aventura', 'Super-Herói'];1h 55min;12
