link;title;year;streamings;synopsis_content;synopsis_lemming;synopsis_stemming;just_watch_rating;rotten_tomatoes_rating;imdb_ratings;genres;movie_duration;age_classification
https://www.justwatch.com/br/filme/the-brutalist;O Brutalista(2024);(2024);['Amazon Prime Video', 'Apple TV', 'Amazon Prime Video', 'Apple TV', 'Amazon Prime Video', 'Apple TV', 'Cinemark', 'Centerplex Cinemas', 'Amazon Video', 'Amazon Video', 'Claro video', 'Amazon Prime Video with Ads'];László Toth é um arquiteto visionário que se muda para a América com sua esposa em 1947, fugindo de uma Europa devastada. Procurando por uma vida melhor, eles se deparam com um cliente rico que dá a oportunidade que pode mudar suas vidas para sempre.;['lászló', 'toth', 'arquiteto', 'visionário', 'muda', 'américa', 'esposa', 'fugindo', 'europa', 'devastada', 'procurando', 'vida', 'melhor', 'deparam', 'cliente', 'rico', 'oportunidade', 'pode', 'mudar', 'vidas', 'sempre'];['lászló', 'toth', 'arquitet', 'vision', 'mud', 'amér', 'esp', '1947', 'fug', 'europ', 'devast', 'procur', 'vid', 'melhor', 'dep', 'client', 'ric', 'dá', 'oportun', 'pod', 'mud', 'vid', 'sempr'];79%(3.9k);93%;7.3  (105k);['Drama'];3h 35min;18
https://www.justwatch.com/br/filme/karate-kid-lendas;Karate Kid: Os Campeões(2025);(2025);['HBO Max Amazon Channel', 'Apple TV', 'Apple TV', 'Claro tv+', 'Amazon Prime Video', 'Amazon Video', 'HBO Max Amazon Channel', 'HBO Max'];Li Fung é um prodígio de Kung Fu em Beijing, mas tudo muda quando se muda para Nova York com sua mãe. Entrando em uma competição de Karate, o professor de Li, Sr. Han, pede ajuda a Daniel LaRusso, trazendo as duas gerações de Karatê Kid em um filme.;['fung', 'prodígio', 'kung', 'beijing', 'tudo', 'muda', 'muda', 'nova', 'york', 'mãe', 'entrando', 'competição', 'karate', 'professor', 'han', 'pede', 'ajuda', 'daniel', 'larusso', 'trazendo', 'duas', 'gerações', 'karatê', 'kid', 'filme'];['li', 'fung', 'prodígi', 'kung', 'fu', 'beijing', 'tud', 'mud', 'mud', 'nov', 'york', 'mãe', 'entr', 'compet', 'karat', 'profes', 'li', 'sr', 'han', 'ped', 'ajud', 'daniel', 'laruss', 'traz', 'dua', 'ger', 'karat', 'kid', 'film'];85%(1.1k);57%;;['Ação & Aventura', 'Drama'];1h 34min;12
https://www.justwatch.com/br/filme/ballerina;Do Universo de John Wick: Ballerina(2025);(2025);['Apple TV', 'Apple TV', 'Apple TV', 'Amazon Prime Video', 'Claro tv+', 'Amazon Video', 'Amazon Video', 'Claro video'];A academia de dança não é para é uma simples escola de ballet e, sim, uma escola de assassinas. Esta bailarina (Ana de Armas) usa todo o seu treinamento para se vingar de todos os responsáveis pela morte de sua família.;['academia', 'dança', 'simple', 'escola', 'ballet', 'sim', 'escola', 'assassinas', 'bailarina', 'ana', 'armas', 'usa', 'todo', 'treinamento', 'vingar', 'todos', 'responsáveis', 'morte', 'família'];['academ', 'danç', 'simpl', 'escol', 'ballet', 'sim', 'escol', 'assassin', 'bailarin', 'ana', 'arm', 'usa', 'tod', 'trein', 'ving', 'tod', 'respons', 'mort', 'famíl'];91%(3.1k);76%;6.9  (106k);['Ação & Aventura', 'Mistério & Thriller', 'Crime', 'Thriller de Ação'];2h 5min;18
https://www.justwatch.com/br/filme/together-2025;Juntos(2025);(2025);['Apple TV', 'Apple TV', 'Claro tv+', 'Amazon Prime Video', 'Amazon Video'];Como um casal disfuncional, Tim (Dave Franco) e Millie (Alison Brie), decidem se mudar para uma cidade isolada para fortalecer o relacionamento. Mas a relação conturbada dos dois só piora quando os segredos da cidade e uma força sombria traz escuridão e destruição para a relação.;['casal', 'disfuncional', 'tim', 'dave', 'franco', 'millie', 'alison', 'brie', 'decidem', 'mudar', 'cidade', 'isolada', 'fortalecer', 'relacionamento', 'relação', 'conturbada', 'doi', 'piora', 'segredos', 'cidade', 'força', 'sombria', 'traz', 'escuridão', 'destruição', 'relação'];['casal', 'disfunc', 'tim', 'dav', 'franc', 'milli', 'alison', 'bri', 'decid', 'mud', 'cidad', 'isol', 'fortalec', 'relacion', 'relaç', 'conturb', 'doi', 'pior', 'segred', 'cidad', 'forç', 'sombr', 'traz', 'escur', 'destru', 'relaç'];87%(801);90%;6.8  (39k);['Terror', 'Ficção Científica', 'Romance', 'Comédia Romântica'];1h 41min;16
https://www.justwatch.com/br/filme/nobody-2;Ninguém 2(2025);(2025);['Apple TV', 'Apple TV', 'Apple TV', 'Amazon Prime Video', 'Claro tv+', 'Amazon Video', 'Amazon Video'];Bob Odenkirk retorna como Hutch Mansell, o ex-assassino letal, agora pai suburbano, quatro anos após os eventos do primeiro filme. Saindo de férias com sua família, o passado de Hutch atrapalha toda a diversão quando descobre um operador de parque corrupto, um xerife questionável e uma chefe do crime perigosa.;['bob', 'odenkirk', 'retorna', 'hutch', 'mansell', 'exassassino', 'letal', 'agora', 'pai', 'suburbano', 'quatro', 'ano', 'após', 'eventos', 'primeiro', 'filme', 'saindo', 'férias', 'família', 'passado', 'hutch', 'atrapalha', 'toda', 'diversão', 'descobre', 'operador', 'parque', 'corrupto', 'xerife', 'questionável', 'chefe', 'crime', 'perigosa'];['bob', 'odenkirk', 'retorn', 'hutch', 'mansell', 'exassassin', 'letal', 'agor', 'pai', 'suburb', 'quatr', 'ano', 'após', 'event', 'prim', 'film', 'saind', 'férias', 'famíl', 'pass', 'hutch', 'atrapalh', 'tod', 'divers', 'descobr', 'oper', 'parqu', 'corrupt', 'xerif', 'question', 'chef', 'crim', 'perig'];89%(748);78%;6.3  (41k);['Mistério & Thriller', 'Ação & Aventura', 'Comédia', 'Crime', 'Thriller de Ação'];1h 29min;16
https://www.justwatch.com/br/filme/jurassic-world-4;Mundo Jurássico - Renascimento(2025);(2025);['Apple TV', 'Apple TV', 'Apple TV', 'Amazon Prime Video', 'Amazon Video', 'Amazon Video'];Reiniciando a franquia, Zora Bennett é uma mercenária contratada por uma empresa farmacêutica que promete desenvolver uma cura lucrativa sem igual. Se passando anos após os eventos de Jurassic World: Domínio, Zora lidera um grupo para encontrar e coletar o DNA dos últimos dinossauros vivendo no equador.;['reiniciando', 'franquia', 'zora', 'bennett', 'mercenária', 'contratada', 'empresa', 'farmacêutica', 'promete', 'desenvolver', 'cura', 'lucrativa', 'igual', 'passando', 'ano', 'após', 'eventos', 'jurassic', 'world', 'domínio', 'zora', 'lidera', 'grupo', 'encontrar', 'coletar', 'dna', 'últimos', 'dinossauros', 'vivendo', 'equador'];['reinici', 'franqu', 'zor', 'bennett', 'mercenár', 'contrat', 'empr', 'farmac', 'promet', 'desenvolv', 'cur', 'lucr', 'igual', 'pass', 'ano', 'após', 'event', 'jurassic', 'world', 'domíni', 'zor', 'lid', 'grup', 'encontr', 'colet', 'dna', 'últ', 'dinossaur', 'viv', 'equ'];75%(3k);50%;5.9  (135k);['Mistério & Thriller', 'Ação & Aventura', 'Ficção Científica', 'Robôs'];2h 13min;14
https://www.justwatch.com/br/filme/incendios;Incendies - A Mulher que Canta(2010);(2010);['Reserva Imovision Amazon Channel', 'Amazon Prime Video'];Em um filme de Denis Villeneuve, os irmãos gêmeos, Jeanne e Simon, vão ao notário para descobrir mais sobre o testamento após perderem a mãe. Apenas na morte, eles descobrem que sua mãe deixou dois envelopes, um para seu pai (que acreditavam estar morto) e um para seu irmão (que não sabiam da existência), lançando os gêmeos em uma jornada sobre o passado de sua mãe.;['filme', 'denis', 'villeneuve', 'irmãos', 'gêmeos', 'jeanne', 'simon', 'vão', 'notário', 'descobrir', 'sobre', 'testamento', 'após', 'perderem', 'mãe', 'apenas', 'morte', 'descobrem', 'mãe', 'deixou', 'doi', 'envelope', 'pai', 'acreditavam', 'morto', 'irmão', 'sabiam', 'existência', 'lançando', 'gêmeos', 'jornada', 'sobre', 'passado', 'mãe'];['film', 'denil', 'villeneuv', 'irm', 'gême', 'jeann', 'simon', 'vão', 'not', 'descobr', 'sobr', 'test', 'após', 'perd', 'mãe', 'apen', 'mort', 'descobr', 'mãe', 'deix', 'doi', 'envelop', 'pai', 'acredit', 'mort', 'irm', 'sab', 'exist', 'lanç', 'gême', 'jorn', 'sobr', 'pass', 'mãe'];92%(5.4k);91%;8.3  (237k);['Guerra & Militar', 'Mistério & Thriller', 'Drama', 'Europeu', 'Drama de Guerra'];2h 11min;14
https://www.justwatch.com/br/filme/tempo-de-matar;Tempo de Matar(1996);(1996);['Amazon Prime Video', 'Disney Plus', 'Amazon Prime Video', 'Disney Plus', 'Amazon Prime Video', 'Amazon Video', 'Amazon Prime Video with Ads'];Envolvido em marchas frenéticas de activistas, no terror do Klan, no clamor dos meios de comunicação e motins brutais, um jovem e idealista advogado elabora para o Tribunal uma defesa apaixonadamente, uma batalha pela justiça.;['envolvido', 'marchas', 'frenéticas', 'activistas', 'terror', 'klan', 'clamor', 'meios', 'comunicação', 'motins', 'brutais', 'jovem', 'idealista', 'advogado', 'elabora', 'tribunal', 'defesa', 'apaixonadamente', 'batalha', 'justiça'];['envolv', 'march', 'frené', 'activ', 'terr', 'klan', 'clam', 'mei', 'comunic', 'motim', 'brut', 'jov', 'ideal', 'advog', 'elab', 'tribun', 'defês', 'apaixonad', 'batalh', 'justiç'];96%(8.2k);67%;7.5  (194k);['Mistério & Thriller', 'Crime', 'Drama', 'Tribunal', 'Direitos Civis e Justiça Social'];2h 29min;14
https://www.justwatch.com/br/filme/o-lado-selvagem;O Lado Selvagem(2007);(2007);['Paramount+ Amazon Channel', 'Apple TV', 'Apple TV', 'Apple TV', 'Amazon Prime Video', 'Netflix', 'Netflix Standard with Ads', 'Claro tv+', 'Paramount Plus', 'Amazon Video', 'Amazon Video', 'Paramount+ Amazon Channel', 'Paramount Plus Premium'];Baseado numa história verdadeira, o filme conta a vida de Christopher McCandless, um jovem americano de classe média, recém-formado: após uma infância sufocada por um pai abusivo e uma mãe passiva, e muitos anos de desprezo à sociedade em geral, ele deixa a sua vida para trás, queimando o seu dinheiro e abandonando o que não é essencial, para desaparecer rumo a uma vida em meio à natureza selvagem e em plena liberdade. O que lhe aconteceu transformou-o num símbolo: era um aventureiro heroico, um idealista ingénuo ou um filho perdido numa vida trágica e infeliz?;['baseado', 'história', 'verdadeira', 'filme', 'conta', 'vida', 'christopher', 'mccandless', 'jovem', 'americano', 'classe', 'média', 'recémformado', 'após', 'infância', 'sufocada', 'pai', 'abusivo', 'mãe', 'passiva', 'muitos', 'ano', 'desprezo', 'sociedade', 'geral', 'deixa', 'vida', 'trás', 'queimando', 'dinheiro', 'abandonando', 'essencial', 'desaparecer', 'rumo', 'vida', 'meio', 'natureza', 'selvagem', 'plenum', 'liberdade', 'aconteceu', 'transformouo', 'símbolo', 'aventureiro', 'heroico', 'idealista', 'ingénuo', 'filho', 'perdido', 'vida', 'trágica', 'infeliz'];['base', 'histór', 'verd', 'film', 'cont', 'vid', 'christoph', 'mccandles', 'jov', 'americ', 'cl', 'méd', 'recémform', 'após', 'infânc', 'sufoc', 'pai', 'abus', 'mãe', 'passiv', 'muit', 'ano', 'desprez', 'sociedad', 'geral', 'deix', 'vid', 'trá', 'queim', 'dinh', 'abandon', 'essenc', 'desaparec', 'rum', 'vid', 'mei', 'natur', 'selv', 'plen', 'liberdad', 'acontec', 'transformou', 'símbol', 'aventur', 'hero', 'ideal', 'ingénu', 'filh', 'perd', 'vid', 'trág', 'infeliz'];92%(15k);83%;8.0  (687k);['Drama', 'Ação & Aventura', 'Cinebiografias'];2h 28min;12
https://www.justwatch.com/br/filme/how-to-train-your-dragon-2025;Como Treinares o Teu Dragão(2025);(2025);['Apple TV', 'Apple TV', 'Apple TV', 'Amazon Prime Video', 'Amazon Video', 'Amazon Video', 'Claro video'];Contando o começo da história de Soluço, o filme live-action de Como Treinar o Seu Dragão foca no jovem viking que não se encaixa em sua sociedade brutal. Quando Soluço faz amizade com Banguela, um jovem dragão, ele precisa decidir quem quer ser em uma sociedade que caça dragões.;['contando', 'começo', 'história', 'soluço', 'filme', 'liveaction', 'treinar', 'dragão', 'foca', 'jovem', 'viking', 'encaixa', 'sociedade', 'brutal', 'soluço', 'faz', 'amizade', 'banguela', 'jovem', 'dragão', 'precisa', 'decidir', 'quer', 'sociedade', 'caça', 'dragões'];['cont', 'começ', 'histór', 'soluç', 'film', 'liveaction', 'trein', 'drag', 'foc', 'jov', 'viking', 'encaix', 'sociedad', 'brut', 'soluç', 'faz', 'amizad', 'banguel', 'jov', 'drag', 'precis', 'decid', 'qu', 'sociedad', 'caç', 'drag'];94%(2.5k);77%;7.8  (97k);['Fantasia', 'Família', 'Ação & Aventura', 'Comédia', 'Drama'];2h 5min;10
https://www.justwatch.com/br/filme/elio;Elio(2025);(2025);['Disney Plus', 'Disney Plus', 'Amazon Prime Video'];Abduzido por engano, Elio deve agir como o líder da Terra durante uma conferência interplanetária, contendo alienígenas de diferentes galáxias. Esse garoto cheio de imaginação precisa explorar os diferentes alienígenas excêntricos para descobrir mais sobre si.;['abduzido', 'engano', 'elio', 'deve', 'agir', 'líder', 'terra', 'durante', 'conferência', 'interplanetária', 'contendo', 'alienígenas', 'diferentes', 'galáxias', 'garoto', 'cheio', 'imaginação', 'precisa', 'explorar', 'diferentes', 'alienígenas', 'excêntricos', 'descobrir', 'sobre'];['abduz', 'engan', 'eli', 'dev', 'agir', 'líd', 'terr', 'dur', 'confer', 'interplanetár', 'cont', 'alienígen', 'difer', 'galáx', 'garot', 'chei', 'imagin', 'precis', 'explor', 'difer', 'alienígen', 'excêntr', 'descobr', 'sobr', 'si'];86%(1k);83%;6.7  (26k);['Animação', 'Ficção Científica', 'Comédia', 'Drama', 'Família', 'Fantasia', 'Animação Para Toda a Família'];1h 37min;L
https://www.justwatch.com/br/filme/perfect-days;Dias Perfeitos(2023);(2023);['Apple TV', 'Apple TV', 'Apple TV', 'Amazon Prime Video', 'Netflix', 'Netflix Standard with Ads', 'MUBI Amazon Channel', 'Amazon Video', 'Amazon Video', 'MUBI'];Hirayama limpa banheiros públicos, pilota sua van ao som de fitas de rock dos anos 70 e, nos intervalos, fotografa a luz que atravessa as copas. Mas tudo racha quando velhos conhecidos reabrem lembranças que ele preferia esquecer, e Wim Wenders revela a poesia escondida nesses gestos simples.;['hirayama', 'limpa', 'banheiros', 'públicos', 'pilota', 'van', 'som', 'fitas', 'rock', 'ano', 'intervalos', 'fotografa', 'luz', 'atravessa', 'copas', 'tudo', 'racha', 'velhos', 'conhecidos', 'reabrem', 'lembranças', 'preferia', 'esquecer', 'wim', 'wenders', 'revela', 'poesia', 'escondida', 'ness', 'gestos', 'simple'];['hirayam', 'limp', 'banh', 'públic', 'pilot', 'van', 'som', 'fit', 'rock', 'ano', '70', 'interval', 'fotograf', 'luz', 'atravess', 'cop', 'tud', 'rach', 'velh', 'conhec', 'reabr', 'lembranç', 'pref', 'esquec', 'wim', 'wend', 'revel', 'poes', 'escond', 'ness', 'gest', 'simpl'];91%(5.1k);96%;7.9  (91k);['Drama', 'Drama Emocionante'];2h 4min;12
https://www.justwatch.com/br/filme/anora;Anora(2024);(2024);['Amazon Prime Video', 'Apple TV', 'Amazon Prime Video', 'Apple TV', 'Amazon Prime Video', 'Apple TV', 'Cinemark', 'Amazon Video', 'Amazon Video', 'Claro video', 'Amazon Prime Video with Ads'];Anora, uma jovem trabalhadora do sexo, é levada para fora da sua vida cotidiana como dançarina erótica pelo filho impulsivo de um oligarca russo. Eles se casam, mas os pais do noivo farão de tudo para anular a união.;['anora', 'jovem', 'trabalhadora', 'sexo', 'levada', 'vida', 'cotidiana', 'dançarina', 'erótica', 'filho', 'impulsivo', 'oligarca', 'russo', 'casam', 'pais', 'noivo', 'farão', 'tudo', 'anular', 'união'];['anor', 'jov', 'trabalh', 'sex', 'lev', 'vid', 'cotidi', 'dançarin', 'eró', 'filh', 'impuls', 'oligarc', 'russ', 'cas', 'pal', 'noiv', 'far', 'tud', 'anul', 'uni'];82%(11k);93%;7.4  (228k);['Comédia', 'Drama', 'Romance', 'Drama Emocionante', 'Comédia Dramática'];2h 19min;16
https://www.justwatch.com/br/filme/exterminio-2;Extermínio 2(2007);(2007);['Disney Plus', 'HBO Max Amazon Channel', 'Disney Plus', 'Netflix', 'Amazon Prime Video', 'Netflix Standard with Ads', 'Claro tv+', 'HBO Max Amazon Channel', 'HBO Max'];Os Estados Unidos começam a reconstruir o país após vencerem a guerra contra o vírus que aniquilou a Grã-Bretanha há 6 meses. Porém, a primeira leva de refugiados traz uma variação ainda mais mortal do vírus.;['estados', 'unidos', 'começam', 'reconstruir', 'país', 'após', 'vencerem', 'guerra', 'contra', 'vírus', 'aniquilou', 'grãbretanha', 'meses', 'porém', 'primeira', 'lev', 'refugiados', 'traz', 'variação', 'ainda', 'mortal', 'vírus'];['est', 'unid', 'começ', 'reconstru', 'país', 'após', 'venc', 'guerr', 'contr', 'víru', 'aniquil', 'grãbretanh', '6', 'mes', 'porém', 'prim', 'lev', 'refugi', 'traz', 'vari', 'aind', 'mort', 'víru'];91%(14k);73%;6.8  (345k);['Terror', 'Ficção Científica', 'Mistério & Thriller', 'Ficção Científica de Zumbi'];1h 39min;18
https://www.justwatch.com/br/filme/vremia-pervykh;Spacewalker: Rumo ao Desconhecido(2017);(2017);['Amazon Prime Video', 'Apple TV', 'Amazon Prime Video', 'Apple TV', 'Amazon Prime Video', 'Apple TV', 'Amazon Video', 'Amazon Video', 'Looke', 'Looke Amazon Channel', 'Amazon Prime Video with Ads'];"Em março de 1965, a União Soviética e os Estados Unidos disputavam o primeiro lugar na corrida pela conquista espacial e o próximo e ambicioso passo era fazer um homem ""caminhar"" em pleno espaço sideral. Dois cosmonautas russos, Aleksei Leonov e Pavel Belyayev, se lançam na missão Voskhod 2 com o objetivo de serem os pioneiros desta façanha. Sendo o primeiro ser humano a deixar a nave em um traje espacial e realizar uma caminhada de doze minutos, Leonov entra para a história, mas não sem enfrentar inúmeras dificuldades e perigos, antes e depois da concretização do seu feito.";['março', 'união', 'soviética', 'estados', 'unidos', 'disputavam', 'primeiro', 'lugar', 'corrida', 'conquista', 'espacial', 'próximo', 'ambicioso', 'passo', 'fazer', 'homem', 'caminhar', 'pleno', 'espaço', 'sideral', 'doi', 'cosmonautas', 'russos', 'aleksei', 'leonov', 'pavel', 'belyayev', 'lançam', 'missão', 'voskhod', 'objetivo', 'serem', 'pioneiros', 'desta', 'façanha', 'sendo', 'primeiro', 'humano', 'deixar', 'nave', 'traje', 'espacial', 'realizar', 'caminhada', 'doze', 'minutos', 'leonov', 'entra', 'história', 'enfrentar', 'inúmeras', 'dificuldades', 'perigos', 'ante', 'concretização', 'feito'];['març', '1965', 'uni', 'sovié', 'est', 'unid', 'disput', 'prim', 'lug', 'corr', 'conqu', 'espac', 'próx', 'ambici', 'pass', 'faz', 'hom', 'caminh', 'plen', 'espaç', 'sideral', 'doi', 'cosmon', 'russ', 'aleks', 'leonov', 'pavel', 'belyayev', 'lanç', 'miss', 'voskhod', '2', 'obje', 'ser', 'pioneir', 'dest', 'façanh', 'send', 'prim', 'human', 'deix', 'nav', 'traj', 'espac', 'realiz', 'caminh', 'doz', 'minut', 'leonov', 'entr', 'histór', 'enfrent', 'inúm', 'dificuldad', 'perig', 'ant', 'concre', 'feit'];NAOAVALIADO;NAOAVALIADO;7.2  (8k);['Mistério & Thriller', 'Drama', 'História', 'Comédia', 'Drama de Época'];2h 20min;10
https://www.justwatch.com/br/filme/a-negociacao-1998-0;O Negociador(1998);(1998);['Amazon Prime Video', 'Disney Plus', 'Amazon Prime Video', 'Disney Plus', 'Amazon Prime Video', 'Netflix', 'Netflix Standard with Ads', 'Amazon Prime Video with Ads'];Danny Roman é um especialista da polícia de Chicago em questões relacionadas com reféns. O seu papel é acalmar o sequestrador e levá-lo à rendição. Danny é um excelente profissional e, cada vez mais, é visto como um herói, até que um dia, após a morte de um colega, Danny se torna vítima de uma conspiração em que tudo se inverte e o negociador passa a ser o sequestrador...;['danny', 'roman', 'especialista', 'polícia', 'chicago', 'questões', 'relacionadas', 'reféns', 'papel', 'acalmar', 'sequestrador', 'leválo', 'rendição', 'danny', 'excelente', 'profissional', 'cada', 'vez', 'visto', 'herói', 'dia', 'após', 'morte', 'colega', 'danny', 'torna', 'vítima', 'conspiração', 'tudo', 'inverte', 'negociador', 'passa', 'sequestrador'];['danny', 'roman', 'especi', 'políci', 'chicag', 'quest', 'relacion', 'refém', 'papel', 'acalm', 'sequestr', 'levál', 'rend', 'danny', 'excel', 'profiss', 'cad', 'vez', 'vist', 'heró', 'dia', 'após', 'mort', 'coleg', 'danny', 'torn', 'vítim', 'conspir', 'tud', 'invert', 'negoci', 'pass', 'sequestr'];95%(5.9k);74%;7.3  (163k);['Ação & Aventura', 'Crime', 'Drama', 'Mistério & Thriller', 'Thriller de Ação'];2h 20min;14
